{
  "active_plan": null,
  "architecture_map": "docs/architecture/creator-toolchain.md",
  "created_at": "2026-07-17T16:47:46Z",
  "display_name": "Creator Toolchain",
  "owner_skill": "creator-workspace-manager",
  "privacy_class": "publishable_template",
  "schema_version": "0.4.0",
  "state_contract": ".creator/*.json",
  "updated_at": "2026-07-17T16:47:46Z",
  "workspace_id": "creator-toolchain"
}
